text,style,space_before,space_after,col_id,row_id,cell_width,cell_height,cell_id
昨天在程序委員會，不管是國民黨的提案或是民眾黨的提案，當中寫到邀請未來的賴清德總統到立法院國情報告的內容、事項，每一項都溢出總統的職權，也就是每一項要問的都是行政院院長對立法院負責的權責。為什麼我反對第一項的修正？我認為還是要維持，因為立法院要就國家相關的所有事項對行政院長提出質詢，如果立法院發起邀請總統來就很清楚，委員認為對行政院長質詢，沒有辦法獲得更清楚的、與國家安全相關的國家大政方針才邀請總統來。所以不能將第一項改成現在的文字，那就過當的包山包海，重蹈覆轍，又重新扞格了憲法第五十三條跟五十七條──行政院對立法院負責、行政院作為國家最高行政機關。,內文,0.0,0.0,,,,,
我再講回來，剛剛主席一直不讓我在第十五條之一繼續發言，我在這裡一併重複，第十五條之一我反對的理由是，它違反憲法第五十三條以及憲法第五十七條的原則，對立法院負責的是行政院院長，第十五條之一讓國情報告常態化，每年必須要求總統一定要來，這就是權力分立的扞格跟衝突。好，第十五條之二我也沒有辦法支持民眾黨團，這是我剛剛所說的意見，立法院邀請的話，要focus在總統直接的職權──國家安全相關的事項。總統依第二項，他自己願意來，他可以比較open，他想要跟國會對話什麼，只要總統認為跟他的職權相關，他可以來發表。好，我報告我的意見，我沒有辦法同意民眾黨團的修正。,內文,0.0,0.0,,,,,
主席：林委員。,內文,0.0,0.0,,,,,
林委員思銘：今天委員會的協商，我現在整個聽起來，可能很難達成共識，所以我建議要講到院會再把它講清楚，我建議全案保留，否則這樣的協商……,內文,0.0,0.0,,,,,
沒有，我的style不是這樣，我就是跟主席建議……,內文,0.0,0.0,,,,,
吳委員思瑤：你的style跟傅崐萁不一樣？,內文,0.0,0.0,,,,,
林委員思銘：我很溫柔，我建議主席這樣做。,內文,0.0,0.0,,,,,
吳委員思瑤：不會啦！才剛開始。,內文,0.0,0.0,,,,,
林委員思銘：不然大家都沒有共識嘛！,內文,0.0,0.0,,,,,
吳委員思瑤：我們現在是在補進度，因為委員會逐條沒有討論到……,內文,0.0,0.0,,,,,
林委員思銘：我建議主席做出這樣的裁示。,內文,0.0,0.0,,,,,
吳委員思瑤：現在只好補進度。,內文,0.0,0.0,,,,,
主席：那請問……,內文,0.0,0.0,,,,,
林委員思銘：OK，到院會再把……,內文,0.0,0.0,,,,,
主席：好，請問民眾黨的想法。,內文,0.0,0.0,,,,,
黃委員國昌：其實針對這些條文，我覺得從前面這幾條的條文看起來，連最沒有太大爭議的部分，譬如剛剛第十五條都可以扯到跟條文本身沒有關係的彈劾、罷免、不信任投票、覆議，連記名投票表決到底要怎麼進行，這些事情都要牽扯到條文裡面討論，看起來許多條文都沒有辦法達成什麼樣的共識。當然在整個發言的時間上，我也都很節制，主席需要我說明我就說明，但是其他的部分，我覺得可能在整個處理的程序上，我會尊重主席相關的裁決。我覺得剛剛林思銘首席副書記長表達的意見也值得主席參採。謝謝。,內文,0.0,0.0,,,,,
主席：好，國民黨團以及民眾黨團的想法應該是一致，既然大家都沒有共識，本案就全案保留。,內文,0.0,0.0,,,,,
沈委員發惠：主席，表達一下意見……,內文,0.0,0.0,,,,,
莊委員瑞雄：你要這樣裁決以前，我先講一下。,內文,0.0,0.0,,,,,
主席：不是，有委員提出了嘛！,內文,0.0,0.0,,,,,
沈委員發惠：對，我們表達……,內文,0.0,0.0,,,,,
主席：我們認為這樣做……,內文,0.0,0.0,,,,,
莊委員瑞雄：我會尊重，你讓我講完……,內文,0.0,0.0,,,,,
沈委員發惠：你只問兩個等於沒有問……,內文,0.0,0.0,,,,,
莊委員瑞雄：主席，這個就很弔詭……,內文,0.0,0.0,,,,,
沈委員發惠：你問兩個黨，你還沒有問我們……,內文,0.0,0.0,,,,,
莊委員瑞雄：本來在委員會要逐條審查，你們就逐條保留，全部都保留，說有異議就協商再來討論，然後朝野協商變成繼續保留，有異議沒有共識就送院會再說，這個實在是……我們必須向民眾負責。委員會以後就很簡單，會議裡面都可以不用討論，直接全部都送朝野協商，朝野協商就說好，大家的意見都不一致，全部保留，以後剩一個院會，大家都比賽就好了，這個都把立法委員做小了，想要擴權，卻把自己的職權行使全部都閹割掉，這不好。,內文,0.0,0.0,,,,,
沈委員發惠：最後主席要怎麼裁決，我們大概猜到，也知道了，但是我要講的是，依照民主政治基本的理論及根據，我們相信討論會產生一些結論，這就是為什麼會有朝野協商的制度產生。如果認為講一講沒有共識就保留，連委員會的大體討論、逐條討論都好像變得沒有意義，因為主席還有林思銘委員好像認為所有的討論都不可能會有結果。也許真的是這樣，但是過去朝野協商包括預算、包括法案，那就是需要很大的耐心，這就是我們在每一黨的黨團幹部，大家都有很大的耐心，有時候協商到半夜，在預算審查之後，逐目、逐科就這樣在協商，我相信林思銘委員有參加過。所以為什麼會這樣？就是因為大家相信這些議案不同的意見在討論協商之下，可能會產生共識，也許結果是沒有共識的，但是一開始還沒有討論，就說看起來顯然沒有共識，我認為這個就會讓整個制度空洞化掉，那以後朝野協商變成多此一舉，因為來了，朝野協商只是不能表決而已，要不然就跟委員會一樣，說那就保留、就保留……,內文,0.0,0.0,,,,,
主席：謝謝，我想……,內文,0.0,0.0,,,,,
沈委員發惠：所以我再說一次，我個人反對主席的裁決，但是最後主席要怎麼裁決是你的權力，但是我反對這個裁決，因為我認為應該要逐條地來討論，即使最後結果是沒有共識，也是經過討論之後的沒有共識，而不是主席主觀認為沒有共識。,內文,0.0,0.0,,,,,
主席：因為今天是黨團的協商嘛！因為國民黨黨團以及民眾黨，他們都認為沒有共識，希望全案就送院會……,內文,0.0,0.0,,,,,
莊委員瑞雄：後面都還沒走，你怎麼知道沒有共識？,內文,0.0,0.0,,,,,
主席：不是，我現在在轉述另外兩個黨團的說法，不叫做問我的意見。,內文,0.0,0.0,,,,,
莊委員瑞雄：你那第二十五條也還沒啊！,內文,0.0,0.0,,,,,
主席：莊委員，我剛剛在轉述兩個黨團的說法，不是我的意見，好不好？所以您再仔細聽一下，我跟您報告一下……,內文,0.0,0.0,,,,,
莊委員瑞雄：你不要聽林思銘胡說八道，我講完以後，我馬上會說服他。,內文,0.0,0.0,,,,,
主席：等一下，我跟您報告一下……,內文,0.0,0.0,,,,,
莊委員瑞雄：他馬上會說好。,內文,0.0,0.0,,,,,
主席：我跟您報告一下，莊委員，我剛剛說的是國民黨黨團以及民眾黨，他們表示沒有共識，希望全案保留送院會處理，我現在轉述的是他們兩位的意見，你不要又扯到我身上來。,內文,0.0,0.0,,,,,
吳委員。,內文,0.0,0.0,,,,,
吳委員思瑤：主席，依協商是這樣啦，因為您顯然都滿偏聽的啦。在場有鍾佳濱召委、莊瑞雄委員、沈發惠委員、吳思瑤委員，我們四位都主張因為委員會的逐條討論被剝奪了，我們在協商的時候，可以好好來補進度、趕進度把它補回來，我們有四位委員是這個意見，但是在場國民黨只有林思銘委員一位，民眾黨只有黃國昌總召一位，所以我們有四位委員的聲音要逐條討論，你為什麼偏聽，只要聽兩位委員的主張呢？而且我可以預言，大家不要輕信今天打包協商了……,內文,0.0,0.0,,,,,
主席：吳委員，我們今天是黨團協商，不是個別委員。,內文,0.0,0.0,,,,,
吳委員思瑤：請讓我講話，我在發言。,內文,0.0,0.0,,,,,
主席：我是主席。,內文,0.0,0.0,,,,,
吳委員思瑤：主席，請尊重我的發言時間好嗎？,內文,0.0,0.0,,,,,
主席：我這邊跟您報告一下……,內文,0.0,0.0,,,,,
吳委員思瑤：請尊重我的發言時間好嗎？,內文,0.0,0.0,,,,,
主席：我們今天叫做黨團協商，不是個別委員，謝謝。,內文,0.0,0.0,,,,,
吳委員思瑤：是，如果今天沒有辦法逐條討論，今天的進度就是到第十五條之二，今天的逐條協商到第十五條之二，您要再排下一次協商，再針對十五條之三繼續協商，這樣我可以同意，因為今天你們不想討論。協商就是這樣啊！協商沒有講到一半，在場多數的委員說我們都還要逐條討論，然後另外的少數委員說我要打包，這樣什麼都被沒收掉，而且我可以預言，在聽線上直播的所有公民朋友，我可以預言送到大會的時候，或是送到韓國瑜委員所主持的朝野協商的時候，一樣！同樣的理由，國民黨跟民眾黨又說討論很久了，這裡只處理程序，不用討論了，直接院會表決。我可以預言就是這個結果！一關一關拖過去，我們在委員會的時候，你們國民黨不就是這個理由嗎？說有爭議送協商，協商再討論就好，結果今天在協商了，又不給討論，然後你說黨團協商不給討論就推給韓國瑜，說韓國瑜的朝野協商再討論就好，我跟你預判，以你們傅崐萁總召的「壓霸」，在韓國瑜院長所主持的協商，一樣是不准討論，直接處理程序，不討論實質，所以我堅持，如果主席說今天到這裡第十五條之二，討論到這裡，好！今天協商到這裡……,內文,0.0,0.0,,,,,
林委員思銘：我們尊重主席的裁示。,內文,0.0,0.0,,,,,
吳委員思瑤：我們只協商了三個條文，後面沒有，你要繼續再排協商啊！我們等你啊！我們願意啊！沒有協商只討論兩條，就說整個打包的，沒有！不要重蹈覆轍，不要繼續「壓霸」！所以如果主席裁示要打包協商……,內文,0.0,0.0,,,,,
林委員思銘：國民黨、民眾黨已經把意見表示得很清楚，請主席裁示。,內文,0.0,0.0,,,,,
吳委員思瑤：就是到剛剛的第二條、第十五條之一跟第十五條之二，就協商到這裡，還要再另排協商的時間！,內文,0.0,0.0,,,,,
莊委員瑞雄：協商兩條……,內文,0.0,0.0,,,,,
吳委員思瑤：都要再排協商的時間啊！「照起工」來，就是這樣啊！領人民的薪水就是要好好開會逐條審查，委員會已經被沒收了，協商不能再被沒收討論啊！我們現在在趕進度。,內文,0.0,0.0,,,,,
沈委員發惠：有耐心一點，你們……,內文,0.0,0.0,,,,,
莊委員瑞雄：召委，我建議啦！,內文,0.0,0.0,,,,,
吳委員思瑤：就今天處理三條，可以啊！,內文,0.0,0.0,,,,,
莊委員瑞雄：我跟你建議啦！,內文,0.0,0.0,,,,,
吳委員思瑤：今天處理三條，保留。,內文,0.0,0.0,,,,,
沈委員發惠：贊成！贊成吳思瑤委員的意見。,內文,0.0,0.0,,,,,
吳委員思瑤：對啊！今天處理三條，再開協商啊！,內文,0.0,0.0,,,,,
莊委員瑞雄：我們早上……,內文,0.0,0.0,,,,,
吳委員思瑤：對啊！,內文,0.0,0.0,,,,,
莊委員瑞雄：你認為沒有共識的部分要保留，我們是……,內文,0.0,0.0,,,,,
吳委員思瑤：對啊！沒有審的要再協商啊！再開協商！,內文,0.0,0.0,,,,,
莊委員瑞雄：其他還沒有協商的部分，我們再擇期啦，好不好？,內文,0.0,0.0,,,,,
吳委員思瑤：是啊！這才是程序，我們在各個委員會都是這樣嘛！在各個委員會都是這樣嘛！,內文,0.0,0.0,,,,,
主席：我們剛剛已經講了……,內文,0.0,0.0,,,,,
吳委員思瑤：今天就是處理討論了三條保留，另外沒有討論的再擇期協商。,內文,0.0,0.0,,,,,
莊委員瑞雄：再擇期協商啦！,內文,0.0,0.0,,,,,
主席：……無法達成共識……,內文,0.0,0.0,,,,,
吳委員思瑤：但是無法達成共識，也只有前面三條，後面可能有共識啊！不要放棄自我、不要放棄自我！,內文,0.0,0.0,,,,,
莊委員瑞雄：擇期就好了啦！,內文,0.0,0.0,,,,,
主席：沒有什麼擇期！,內文,0.0,0.0,,,,,
吳委員思瑤：不要放棄自己，不要放棄我們的權利，不要放棄大家的智慧，透過討論可以匯聚共識，不要放棄好嗎？不要輕言放棄好嗎？這麼沒有「擋頭」？不用擔心！對，繼續討論，雖然我也覺得很痛苦，今天提案委員居然都沒有在場說明，害我們要隔空抓藥，要試想他提案的緣由是什麼。正因為今天提案的委員都沒有來，所以主席，我們應該擇期再協商。,內文,0.0,0.0,,,,,
莊委員瑞雄：鄭天財，你剛好來，譴責國民黨一下。,內文,0.0,0.0,,,,,
吳委員思瑤：擇期再協商！,內文,0.0,0.0,,,,,
莊委員瑞雄：朝野協商，協商兩個條文，再來不想協商了。,內文,0.0,0.0,,,,,
沈委員發惠：打包了。,內文,0.0,0.0,,,,,
吳委員思瑤：那有打包的！對不對？你以為在吃菜尾喔！打包！以為在吃菜尾喔？我是餓到還沒吃午飯，不能打包啦！,內文,0.0,0.0,,,,,
鄭天財Sra Kacaw委員：原住民的法案在協商的時候，民進黨不來的，很多次啦！很多次啦！,內文,0.0,0.0,,,,,
吳委員思瑤：但是會讓你討論喔！人家沈發惠都有到喔！,內文,0.0,0.0,,,,,
鄭天財Sra Kacaw委員：對，那個案有……,內文,0.0,0.0,,,,,
吳委員思瑤：沈發惠都有到喔！所以鄭天財委員。你馬上就被打臉了，人家有來，不是沒有來！,內文,0.0,0.0,,,,,
鄭天財Sra Kacaw委員：那是第9屆的事……,內文,0.0,0.0,,,,,
莊委員瑞雄：所以不協商就要譴責，對不對？,內文,0.0,0.0,,,,,
鄭天財Sra Kacaw委員：不是，沒有來就送院長協商。,內文,0.0,0.0,,,,,
吳委員思瑤：所以要來啊！,內文,0.0,0.0,,,,,
莊委員瑞雄：沒有繼續協商，後面你不是覺得很遺憾嗎？,內文,0.0,0.0,,,,,
吳委員思瑤：但是我們有來啊！我們有來的人要討論啊！鄭天財委員。,內文,0.0,0.0,,,,,
鄭天財Sra Kacaw委員：沒有來就送院長協商。,內文,0.0,0.0,,,,,
吳委員思瑤：我們有來的委員要逐條繼續討論啊！,內文,0.0,0.0,,,,,
鄭天財Sra Kacaw委員：送給院長協商啦！,內文,0.0,0.0,,,,,
吳委員思瑤：如果主席要停在第十五條之二，那就再擇期協商，我們接著第十五條之三。,內文,0.0,0.0,,,,,
鄭天財Sra Kacaw委員：因為在……,內文,0.0,0.0,,,,,
莊委員瑞雄：你不要到這邊來亂出草好不好？,內文,0.0,0.0,,,,,
鄭天財Sra Kacaw委員：是你要我發言的。,內文,0.0,0.0,,,,,
莊委員瑞雄：話都不會講。,內文,0.0,0.0,,,,,
鄭天財Sra Kacaw委員：我本來沒有要發言。,內文,0.0,0.0,,,,,
莊委員瑞雄：你這個叫白目！,內文,0.0,0.0,,,,,
鄭天財Sra Kacaw委員：謝謝你讓我發言。,內文,0.0,0.0,,,,,
莊委員瑞雄：你當頭目、你當白目！,內文,0.0,0.0,,,,,
鄭天財Sra Kacaw委員：我沒有資格當頭目，那個有標準的，不是隨便可以當的。,內文,0.0,0.0,,,,,
沈委員發惠：主席，我們擇期繼續協商啦！,內文,0.0,0.0,,,,,
林委員思銘：主席裁示！尊重主席的決定。,內文,0.0,0.0,,,,,
吳委員思瑤：主席，再協商啊！今天就這三條啊！,內文,0.0,0.0,,,,,
主席：我跟各位報告一下，我現在報告，因為有民眾黨已經都不出席了嘛！,內文,0.0,0.0,,,,,
吳委員思瑤：他沒收了他的權利，我們為什麼……,內文,0.0,0.0,,,,,
主席：不是所謂的沒收，那就是協商，就是沒有協商成立，所以不叫做什麼……,內文,0.0,0.0,,,,,
吳委員思瑤：老師，不可以這樣，沒有蹺課的同學……因為蹺課的同學沒有來上課，今天這堂課就下課嗎？我們是乖乖在這裡上課的學生，老師不能這樣！,內文,0.0,0.0,,,,,
主席：因為民眾黨團沒有出席，所以本日的協商……,內文,0.0,0.0,,,,,
吳委員思瑤：蹺課的學生！,內文,0.0,0.0,,,,,
主席：因為有黨團代表沒有出席討論，所以無法達成共識，本日五案，就是五個主題，因為仍待繼續溝通取得共識，後續會依立法院職權行使法第十二章相關規定辦理。,內文,0.0,0.0,,,,,
吳委員思瑤：再擇期協商！,內文,0.0,0.0,,,,,
主席：不是，那我們就直接送院會。,內文,0.0,0.0,,,,,
吳委員思瑤：沒有、沒有、沒有！,內文,0.0,0.0,,,,,
沈委員發惠：再擇期協商啦！,內文,0.0,0.0,,,,,
主席：好，謝謝各位，散會。,內文,0.0,0.0,,,,,
散會（13時15分）,內文,0.0,0.0,,,,,
