text,style,space_before,space_after,col_id,row_id,cell_width,cell_height,cell_id
鍾委員佳濱：彈劾不記名，可是罷免要記名，彈劾是對總統進行彈劾。,內文,0.0,0.0,,,,,
周秘書長萬來：主席，我再一分鐘說明可不可以？,內文,0.0,0.0,,,,,
主席：請說。,內文,0.0,0.0,,,,,
周秘書長萬來：因為增修條文裡面的不信任案，如果從議學上來講，對人是不記名、對事記名，那不信任案就對人，已經在增修條文就改成記名了，增修條文就明定記名投票了嘛！所以要用議學裡面對人、對事，這個我就很難在這邊做報告，所以我才說請各位委員去合議，我沒有增加意見在裡面。,內文,0.0,0.0,,,,,
林委員思銘：有意見就送院會啦！送院會處理了啦！好不好？講不清楚，保留啦！,內文,0.0,0.0,,,,,
主席：好，如果大家都沒有共識，那就乾脆保留送院會處理。,內文,0.0,0.0,,,,,
林委員思銘：這條保留啦！好不好？,內文,0.0,0.0,,,,,
吳委員思瑤：等一下，我補充一下，我也同意送保留處理，為什麼呢？理由要講清楚，因為跳過了委員會討論的程序，所以我們剛剛對於現行的6項記名或無記名，它過去行使的歷史脈絡是什麼，我們都沒有辦法在委員會討論，只好在協商討論。以目前來講，其實緊急命令是非常非常嚴肅跟重要的事情，我當然當立委只有九年，我沒有碰過，但我印象中可以記得的就是李登輝針對921的時候提起的緊急命令，因為當時我們並沒有震災條例，也沒有災害防救法，所以當時總統為了要超越法律，就是目前沒有法律來執行的事情，所以他的緊急命令等於是賦予在國家或人民遭受緊急危難的時候，有一個準法律的這個空間可以行使。其實我看大法官釋字第543號裡面，對於緊急命令的追認權，行政部門是提出來，立法院只有追認，yes or no，但是追認也有部分追認或是全部追認，這件事情因為我們都沒有經歷過，現在立法委員針對其他的立法相對都更為嚴謹完備。譬如之前發生傳染性疾病的時候，也曾經討論要不要總統來頒緊急命令，但是我們研議相關的法律配套是越來越進步，所以這幾年來是沒有過，上一次應該就是921的時候。所以我認為更嚴謹的是這個條文保留，但是在院會處理的時候，更為嚴謹的是我們應當針對現在的6個在院會所行使的投票行為，彈劾、罷免、不信任、覆議、緊急命令跟人事同意權的各個方式，哪一項應當是在哪一個level，用記名或無記名更為嚴謹，它一定都有法律的立論，我認為這樣討論才是負責，好嗎？所以這個在院會必須做這樣的處理，當然也期待提案的委員要負責任說明他提案的緣由，這樣才是嚴謹，才是嚴謹，因為這是涉及憲法的權力，所以這個案子我們保留。,內文,0.0,0.0,,,,,
主席：我們保留送院會，謝謝。,內文,0.0,0.0,,,,,
吳委員思瑤：好。,內文,0.0,0.0,,,,,
主席：下一條，第十五條之一，請問各位委員是不是照剛剛林思銘委員所提的，我們就依傅崐萁的版本，請問一下，第十五條之一，各位有無異議？,內文,0.0,0.0,,,,,
林委員思銘：沒有意見。,內文,0.0,0.0,,,,,
主席：好，因為有異議的話，我們就保留送院會。,內文,0.0,0.0,,,,,
吳委員思瑤：有意見也是要講一下，好嗎？這一條是重中之重耶！第十五條之一，職權行使法從第十五條之一開始，有好幾個條文都在處理總統到立法院國情報告的程序。昨天在程序委員會的時候，國民黨也好，民眾黨也好，也都有援引職權行使法第十五條相關的條例，要提請、邀請未來總統賴清德來立法院國情報告。現行條文是只有一條一項，完全就是回應憲法增修條文第四條第三項的規定，立法院「得」於每年集會時聽取總統國情報告，所以它的keyword第一個是「得」；第二個是「報告」，就是only for報告這樣。現在傅崐萁委員是增加了兩項，第一項也修，怎麼好像是我在替傅崐萁委員做提案說明，好怪喔！第一項，他是要常態化嘛；然後第二項也是把時間明定了，是2月1號，然後3月1號要來進行，時間就把它block住了；第三項是新任總統就職兩週內，就要先送國情報告書，然後在一個月來進行國情報告，所以他把時間定死了，而且定死的包括實體的總統人來報告，也包括送報告書文件的時間。,內文,0.0,0.0,,,,,
我認為這樣都已經溢出了憲法的授權，而且更綁手綁腳，我個人是沒有辦法同意國民黨幾位委員的提案，我再一次說，怎麼會是我在替傅崐萁委員做提案說明呢？提案委員沒有能力來這裡針對自己的提案做說明嗎？所以這樣子的處理，對於憲法的原文，我覺得有所扞格而且有所逾越，我沒有辦法接受這個條文。,內文,0.0,0.0,,,,,
林委員思銘：主席，我是建議既然吳思瑤委員他們有意見，那我們就送保留嘛！,內文,0.0,0.0,,,,,
鍾委員佳濱：謝謝主席，讓我們在協商的時候就第十五條之一表示意見，其實原來的第十五條之一，它原條文是「依中華民國憲法增修條文第四條第三項規定，立法院得於每年集會時，聽取總統國情報告。」，其實有參與到當年增修條文修改的時候，我們很清楚立法院有許多的職權，在有存在國民大會跟不存在國民大會的時候是不一樣的。其實，剛剛我們秘書長提到的罷免跟彈劾，原來在存有國民大會的時候，罷免權是立法院所有的，但是要提交全國公民去進行表決，因為總統是人民直選的，立法院只能提出罷免案，交全國公民來複決之。就像原來的修憲，立法院可以提出修憲案，後來的增修條文要提到全國公民複決，但是原來對總統的彈劾是在監察院，接著跑到了國民大會，後來又再跑到立法院。,內文,0.0,0.0,,,,,
就目前的國情報告，它在原來的增修條文當中，在還存在國民大會的時候，是在憲法增修條文第一條的後段「國民大會集會時，得聽取總統國情報告，並檢討國是，提供建言；如一年內未集會，由總統召集會議為之，不受憲法第三十條之限制。」，我要說明的是……,內文,0.0,0.0,,,,,
主席：我們今天不是審查會耶！我們今天是協商。,內文,0.0,0.0,,,,,
鍾委員佳濱：我們協商嘛！,內文,0.0,0.0,,,,,
主席：如果這樣的效率……,內文,0.0,0.0,,,,,
鍾委員佳濱：我把它說完嘛！我先說完，簡單講……,內文,0.0,0.0,,,,,
主席：不是，我就不懂，今天我們不是審查會啊！,內文,0.0,0.0,,,,,
鍾委員佳濱：為什麼我認為這一條要審慎？因為原來它把增修條文臚列，其實就是表示增修條文把國民大會這樣儀式性的職權，移到立法院來繼受。但是它放在第十五條之一，就表示原來立法院職權行使法並不存在這樣的一個聽取總統的國情報告，純粹是在2005年增修條文修改將國民大會廢除，才會將國民大會原來總統國情報告這樣一個儀式性的行為移給立法院來進行。,內文,0.0,0.0,,,,,
過去在實務上，像這裡面寫的要2月1號、要1個月內，其實這些提案的體例，都是參照目前我們行政院向立法院負責，而行政院必須向立法院提出這樣的施政報告，它的體例是一樣的。所以我們從國民大會接受了國民大會廢止後儀式性的一個職權，現在卻把它擴張，變成跟立法院直接可以監督行政院，要求行政院來做施政報告的職權的行使、格式、程序類同。這就是為什麼我們一再的認為這個條文期期以為不可為，因為這讓我們目前立法院在進行憲法規範的職權，對行政院進行監督的時候，再跑出了一個跟總統類似的監督權，而這兩個行使的格式、模式幾乎一模一樣。,內文,0.0,0.0,,,,,
為什麼提案人不在現場，我們很難去詢問，但其實主席在，您現在就在臺上，這個完全就是從立法院去監督行政院，聽取施政報告，把它拷貝過來的，這才會引發……為什麼說是憲政上的衝突？因為立法院不對總統進行監督，總統不是對立法院負責，是行政院對立法院負責，當時有這樣一個國情報告，是基於總統原來在1996年之前，是由國民大會選舉的，所以國民大會才取得了對總統聽取國民大會國情報告這樣的權力。但現在總統不是由立法院選的，國民大會也廢止了，我們把一個廢止機關在增修條文裡面的一個權力把它繼受過來，我們就要把它當作是監督行政院一樣的方式來行使，這裡面的確有憲政上的扞格啦！,內文,0.0,0.0,,,,,
過去我們在委員會審查時沒有機會做這樣的討論，今天剛好主席，您本身就是提案委員，所以我藉這個機會來做一個交換意見，因為剛好不巧，本席是1996年選出來的第3屆國大代表，我們很清楚知道，我們不能選總統之後，還拿了一個總統來國情報告的權力。因為1996年總統就直選了，但是國民大會在行使總統聽取國情報告的時候，是完全沒有對於總統行實質上監督的權力，我們只有對總統執行彈劾的權力，那是在幾次修憲當中，一度有過。現在加上這樣一個像監督行政院院長的程序，難免會讓人覺得我們是錯亂的，我們到底是監督行政院，還是監督總統？這一點，還是要懇請讓我們未來有進一步可以討論的空間，我們再來好好討論這第十五條之一的修正及說明的內容，謝謝。,內文,0.0,0.0,,,,,
主席：謝謝召委，因為我們今天是協商，不是審查會，所以如果對於我們的提案內容有異議的話，那就是送院會、保留……既然有異議，沒有問題，我們都尊重大家的異議，或是有要提修正動議，我也沒有意見嘛！,內文,0.0,0.0,,,,,
莊委員瑞雄：不是啦，主席，你剛剛開宗明義，本來我還覺得你很開明，我才……,內文,0.0,0.0,,,,,
主席：不用，不用，不用講這個，不用講這個……,內文,0.0,0.0,,,,,
莊委員瑞雄：不是，你剛不是也講我們今天就是要來逐條討論嗎？,內文,0.0,0.0,,,,,
主席：不是，我們今天可不可就……,內文,0.0,0.0,,,,,
莊委員瑞雄：逐條討論是剛才你講的，不是嗎？,內文,0.0,0.0,,,,,
主席：不是，有異議的話我們就送院會、保留。,內文,0.0,0.0,,,,,
莊委員瑞雄：當然都是有意義的討論啦，沒有意義的有直播了誰敢在這個地方胡說八道呢？,內文,0.0,0.0,,,,,
林委員思銘：這裡講的是「異議」的「異」啦，不是有沒有「意義」，如果大家有意見的話就保留送院會嘛！,內文,0.0,0.0,,,,,
主席：對，那個「異」不是你的「意」，異議的意思不是那樣。,內文,0.0,0.0,,,,,
林委員思銘：不然現在討論，你們也都說你們的意見啊！,內文,0.0,0.0,,,,,
莊委員瑞雄：沒有討論，怎麼會知道大家的意見怎樣可以整合嘛！,內文,0.0,0.0,,,,,
林委員思銘：我們的意見就是按照傅崐萁委員的版本，我們希望按照這個版本立法通過，讓整個總統的國情報告很明確地在條文裡面做規定，你們認為這個好像不太妥當，那我們就保留送院會嘛！送院會處理。,內文,0.0,0.0,,,,,
莊委員瑞雄：立法委員總要有機會把自己的見解在審查條文裡面講出來，看誰講得有沒有道理，或胡說八道嘛！主席，我可以講話吧？,內文,0.0,0.0,,,,,
我想第十五條之一，各位其實也可以去想一想啦，憲法增修條文第四條之三，現行法的規定是立法院每一年集會的時候聽取總統的國情報告，我相信這個也是要求總統被人民選出來以後，本來都是把行政院長放在第一線，希望也有機會讓立法院來聽聽總統的一個看法。可是你注意看，我不曉得傅崐萁委員、吳宗憲委員，還有翁曉玲委員跟呂玉玲委員4個版本，你們要用哪一個版本？4個版本，照我看來，國民黨你們要自己先去整合這4個版本，要整合出一個版本啊！以吳宗憲委員的提案，跟傅崐萁委員的提案、跟其他委員的提案，我就看出你們文字裡面大有不同啊！你們的中心思想是完全不同的啊！從過去立法院的運作，總統都想到國會來做國情報告，可是立法院就會加碼，沒有一問一答就不要來了，過去是總統想來，立法院不給他們來，為什麼總統想來，立法院不給他們來，總統又不能來了呢？因為立法院就是不歡迎你、不讓你來，你不照我的意思啊！總統是不是想來就可以來呢？倒也不是！你看吳宗憲委員你自己本身的提案，你是說總統在每一年的2月1號以前將國情報告書送交立法院，並咨請立法院同意後，3月1號以前到立法院進行國情報告，你的第三項新修訂的是說，新就任總統應於就職兩週內，向立法院提出國情報告書，並咨請立法院同意後；也就是說，你的提案是就算總統想來，第一個，國情報告書要先送到立法院，而且還要經過立法院同意以後，1個月內才可以到立法院來進行國情報告。現在傅崐萁委員的提案就跟你完全不一樣啦！傅崐萁是說，你就是要來，我立法院不用同意，你就是法定義務，變成一個「應」，那我要就教的就是，這樣跟我們現行憲法增修條文第四條第三項，立法院得於每年集會的時候聽取總統報告，是「得」，你現在把它變成「應」，「應」和「得」在法律上整個用意、含義完全是不一樣的。,內文,0.0,0.0,,,,,
主席：是不是可以先聽一下我這邊講，今天我們是在協商，不是在審查，先聽我說，協商的重點應該是大家有沒有共識，沒有共識就送院會處理嘛！應該是這樣，這是今天會議的目的，但又回過頭去講誰的提案怎麼樣、內容又怎麼樣，不是就沒有共識了嘛！,內文,0.0,0.0,,,,,
莊委員瑞雄：所有立法委員都可以討論啊！……就沒意義啦，不是嗎？,內文,0.0,0.0,,,,,
主席：林委員提說到院會再講，因為今天是協商，協商就是你對於提案……我跟你講啦……,內文,0.0,0.0,,,,,
莊委員瑞雄：主席，我跟你講一句話，我保證你嘴就塞住了。,內文,0.0,0.0,,,,,
主席：我跟你說啦，今天提案的人有的也都沒來。,內文,0.0,0.0,,,,,
莊委員瑞雄：今天如果是台灣民眾黨，你敢這樣處理，他們就跟你們翻臉啦！你跟他們聯手，愛怎麼樣就可以怎麼樣。,內文,0.0,0.0,,,,,
主席：今天提案的人沒有來，既然提案的人……,內文,0.0,0.0,,,,,
莊委員瑞雄：你這是閹割自己啦！閹割自己啦！,內文,0.0,0.0,,,,,
主席：提案的人既然已經提這樣子了，那就是沒有共識嘛！,內文,0.0,0.0,,,,,
吳委員思瑤：我講一下、我講一下。,內文,0.0,0.0,,,,,
主席：就是沒有共識啊！你現在又要回過頭去變成逐條審查嗎？,內文,0.0,0.0,,,,,
吳委員思瑤：我講一下、我講一下，主席，我舉手舉了1分鐘了。,內文,0.0,0.0,,,,,
主席：不是，你今天協商要完成逐條審查，要就每一個字，然後去批評每個提案人的意見怎麼樣嗎？,內文,0.0,0.0,,,,,
沈委員發惠：委員可以講話吧？,內文,0.0,0.0,,,,,
主席：不是，只有你講的是對的，提案人講的都是錯的嗎？我們該尊重他們吧！提案是他們，你們既然有異議，不認同他們的想法，那有異議，我們就送院會處理嘛！是不是今天協商應該是這樣？,內文,0.0,0.0,,,,,
吳委員思瑤：我舉手舉了2分鐘……,內文,0.0,0.0,,,,,
主席：好，第十五條之一既然大家沒有共識，那就保留。,內文,0.0,0.0,,,,,
第十五條之二。,法律條文(條)/內文,0.0,0.0,,,,,
吳委員思瑤：我不管……，我舉手舉了2分鐘，不讓我講話？,內文,0.0,0.0,,,,,
主席：第十五條之二有台灣民眾黨的提案……,內文,0.0,0.0,,,,,
吳委員思瑤：沒有講過的道理，真理越辯越明啊！,內文,0.0,0.0,,,,,
主席：請問各位就……,內文,0.0,0.0,,,,,
沈委員發惠：主席，今天是協商，不是你的演講比賽好不好？,內文,0.0,0.0,,,,,
主席：請問各位就提案的部分有無異議？,內文,0.0,0.0,,,,,
吳委員思瑤：有異議、有異議！,內文,0.0,0.0,,,,,
沈委員發惠：你讓委員講一下話，吳思瑤委員舉手舉這麼久了。,內文,0.0,0.0,,,,,
吳委員思瑤：我舉手舉這麼久。,內文,0.0,0.0,,,,,
沈委員發惠：協商不就是大家講話嗎？,內文,0.0,0.0,,,,,
吳委員思瑤：對於第十五條之一，我最後要做我的意見綜整跟補充，好嗎？,內文,0.0,0.0,,,,,
沈委員發惠：主席，要不然協商是什麼意思？我們來這裡……,內文,0.0,0.0,,,,,
吳委員思瑤：主席，就因為你們在委員會沒收了討論……,內文,0.0,0.0,,,,,
主席：我剛剛已經裁示第十五條之一……,內文,0.0,0.0,,,,,
吳委員思瑤：在委員會沒有辦法逐條，協商就是審查的延伸……,內文,0.0,0.0,,,,,
主席：保留送院會。請問各位對第十五條之二有無異議？,內文,0.0,0.0,,,,,
吳委員思瑤：等一下，第十五條之一我還沒有講完，主席，我還沒有講完，有意見！,內文,0.0,0.0,,,,,
沈委員發惠：主席，協商跟主持委員會不一樣。,內文,0.0,0.0,,,,,
吳委員思瑤：我還沒有講完。,內文,0.0,0.0,,,,,
主席：現在已經到第十五條之二。,內文,0.0,0.0,,,,,
吳委員思瑤：可是第十五條之一我還沒有講完。,內文,0.0,0.0,,,,,
沈委員發惠：協商就是大家要表達意見才能協商啊！,內文,0.0,0.0,,,,,
莊委員瑞雄：不是嘛！主席如果還有事情明講嘛！,內文,0.0,0.0,,,,,
吳委員思瑤：我還沒有講完嘛！我還沒有講完嘛！在急什麼？不是啦，第十五條之一我要補充我為什麼反對的理由，好嗎？,內文,0.0,0.0,,,,,
主席：我們現在審查第十五條之二，第十五條之一保留送院會。現在是第十五條之二，請問各位對第十五條之二的條文有無異議？,內文,0.0,0.0,,,,,
吳委員思瑤：這種協商是什麼意義啊？,內文,0.0,0.0,,,,,
沈委員發惠：這是什麼協商啊？我第一次看到……,內文,0.0,0.0,,,,,
主席：我講過了，送院會。,內文,0.0,0.0,,,,,
吳委員思瑤：我就一直在舉手，我舉手舉了3分鐘，不讓我講話。,內文,0.0,0.0,,,,,
鍾委員佳濱：要不要讓黨團提案代表說一下？協商一下，第十五條……,內文,0.0,0.0,,,,,
吳委員思瑤：奇怪了，這麼「壓霸」！,內文,0.0,0.0,,,,,
主席：我現在已經在說第十五條之二大家有無異議？,內文,0.0,0.0,,,,,
吳委員思瑤：有異議。,內文,0.0,0.0,,,,,
鍾委員佳濱：我想聽聽看提案的黨團……,內文,0.0,0.0,,,,,
主席：那你要看他想不想講嘛！,內文,0.0,0.0,,,,,
鍾委員佳濱：好，問一下。,內文,0.0,0.0,,,,,
主席：黃委員，鍾召委請問你有沒有意見要補充？,內文,0.0,0.0,,,,,
黃委員國昌：第十五條之二的修正，事實上，相對的是在第二項的部分，過去立法院職權行使法第十五條之二第一項跟第二項，第一項本來是規定就國家安全大政方針，第二項是總統就其職權相關的國家大政方針，第一項跟第二項在客體面，過去在法條的文字上面有出現彼此的銜接不是非常密合的狀況，所以我們針對文字上面調整，寫了第十五條之二第一項跟第二項，就總統職權相關的大政方針，不管是主動還是被動，就規範客體面的事項予以統一規定，說明。,內文,0.0,0.0,,,,,
主席：提案的台灣民眾黨已經說明完畢。鍾召委。,內文,0.0,0.0,,,,,
鍾委員佳濱：感謝民眾黨黨團黃總召的說明，終於我這樣才知道，因為只是把原來第十五條之二第二項就其職權相關之國家大政方針，他把它從底下拉到上面來重複一次，就是排定議程之後，本來是就國家安全大政方針，還要再加上就總統職權相關之國家大政方針，所以總統來只能就總統職權相關的國家大政方針，顯然是台灣民眾黨所肯定的，所以在第二項要再重複一遍，本來就有的是就其職權相關之國家大政方針，第一項也要就總統職權相關之國家大政方針，我這樣的理解應該沒有錯。就是當時我們在立法院職權行使法第十五條之二，為什麼對於一個本來由國民大會行使的總統國情報告，要特別在第十五條之二裡面強調必須就總統職權相關的國家大政方針，才能夠來進行報告，就是因為要區隔於行政院向立法院負責的憲法第五十條明文規定，避免立法院對總統問一次、對行政院問一次，顯然對總統，跟對行政院長問的要不一樣，所以第十五條之二在當年就把它區隔出來了。,內文,0.0,0.0,,,,,
台灣民眾黨把這樣一個重要的憲政分立精神區隔出來，在第二項要表達，在第一項也要表達，我覺得就法理精神一致性，我是支持的。但是就文字上表達，需不需要在第一項跟第二項都重複表達，我覺得這可以討論，但是至少我覺得這個方向上就是尊重原來憲法體制的精神，第十五條之二當年放了這個，就是要跟行政院長以示區隔。,內文,0.0,0.0,,,,,
我在這裡還是要提醒一下，因為接下來還有第十五條之四，怎麼看不到第十五條之三？我再去找找看第十五條之三放在哪裡，第十五條之三可能沒有修正，我在猜應該是沒有人提修正。我這裡還是要跟在場委員做一個意見交換，就是說，其實立法院從國民大會接受的職權歷經多次修憲變革，憲法本文當中，針對司法院、考試院的人事同意權不是由國民大會行使，而是由監察院行使。當時立法院有的人事同意權，是對行政院長的人事同意權，是因為後來監察院去國會機關化之後，監察院的兩項權力──對考試院和司法院的人事同意權跑到國民大會，又因為國民大會廢止才跑到我們立法院。我還是一樣要強調，原來憲法本文的架構，其實五院制的區隔是清楚的，雖然我們不盡然同意這五院制的設計，但是經過幾次憲法增修條文遞嬗之後，我們發現立法院從廢止的國民大會接收了一些儀式性的作為，可能會衝擊到原來憲法本文中，行政院向立法院負責的架構，以致於必須在立法院職權行使法第十五條之二當中，特別慎重地區隔總統國情報告，只限定於總統職權所在範圍內的國家大政方針，不會跟行政院處理政務必須向立法院報告的內容有所重疊。我肯認這樣的區隔，但是反過來，其實第十五條之二證明第十五條之一這種儀式性的行為，顯然會造成憲政體制的紊亂，所以當年在立法的時候才增加第十五條之二，把總統的報告限制於跟總統職權有關的國家大政方針，這樣的情況而已。等於是你開了一個門可能造成麻煩，又趕快再關上門，這個門開開關關，又打開，又關上，就是因為憲法本文的憲政體制有這樣的要求。,內文,0.0,0.0,,,,,
第十五條之一已經保留了，第十五條之二我本來是認同民眾黨強調總統職權相關文字的精神要貫徹，至於文字上是否要兩邊都表達，我覺得可以討論。,內文,0.0,0.0,,,,,
主席：謝謝，請吳委員發言。,內文,0.0,0.0,,,,,
吳委員思瑤：我不支持民眾黨的提案，我的理由是這樣子，第十五條之二分兩項，第一項的發動者是立法院，立法院可以經四分之一委員的提議，然後院會決議，程序委員會排案就邀總統來，這是立法院的發動權，這是第一項。第二項是總統自己主動要來，總統是主體，總統就其職權相關之國家大政方針得咨請立法院同意，然後到立法院來，所以第二項比較沒有問題，因為是總統主動想要來，當然就是依原條文，依他自己想要來報告的內容，跟他職權行使相關，第二項是沒有問題的。但第一項是立法院邀請總統來，要邀請總統講什麼？我們討論第一項是維持原條文還是民眾黨的版本？我認為就憲法的授權，總統就是負責國防、外交跟兩岸的議題，這是非常清楚的，原始條文是立法院如果邀請總統來，就是依據國家安全相關的國家大政方針，這樣才不會讓立委邀請總統來的議題溢出總統直接的職權，它是包山包海，已經看到這樣的狀況。,內文,0.0,0.0,,,,,
